No.,Store Name,Address,Zip Code,Phone Number,Fax Number,Store Size,Closed,Consultant Available,Service Center Available,Store Description
1,BrightStore Central,"3rd Floor, Star Tower, 10000 Myeongdong-ro, Jung-gu, Seoul",04567,02-5678-1234,02-4321-8765,150 pyeong,N,Y,Y,"BrightStore Central offers a wide range of the latest electronics and friendly consultation services. We promise to provide the best service for your convenience."
2,TechPlanet Seocho,"4th Floor, Hi Tower, 11111 Seocho-daero, Seocho-gu, Seoul",06654,02-6789-2345,02-5432-9876,180 pyeong,N,N,Y,"At TechPlanet Seocho, you can experience a variety of electronic products firsthand and receive personalized services from our expert consultants."
3,SparkShop Dongdaemun,"5th Floor, Spark Building, 22222 Wangsan-ro, Dongdaemun-gu, Seoul",02456,02-7890-3456,02-6543-0987,120 pyeong,N,Y,N,"SparkShop Dongdaemun is a space where you can experience the latest home appliances and diverse digital lifestyles. We prioritize customer satisfaction by leading the latest trends."
4,NextZone Sinchon,"6th Floor, Next Building, 33333 Sinchon-ro, Seodaemun-gu, Seoul",03722,02-8901-4567,02-7654-1098,140 pyeong,N,N,Y,"NextZone Sinchon is where you can find the latest electronic devices with a youthful vibe. Conveniently located, we provide top-notch services to enrich your life."
5,DigitalPeak Gangdong,"2nd Floor, Digital Tower, 44444 Cheonho-daero, Gangdong-gu, Seoul",05223,02-9012-5678,02-8765-2109,160 pyeong,N,Y,N,"DigitalPeak Gangdong is a place where you can find the latest electronics and various accessories all in one place. We always prioritize your convenience with friendly service."